{
  "artifacts": {
    "dataset_index": {
      "artifact_id": "08d84e2d98b8f2ec1a0ac5fbf77f3232ff7924e110c1030d475c28d125d0a77e",
      "manifest": {
        "index_id": "a9bfaab9bb43901cc3d9d9c73b5003c54f727c445bb5b5e613b750d290143441",
        "kind": "dataset_index"
      },
      "media_type": "application/json",
      "schema_version": 1,
      "sha256": "08d84e2d98b8f2ec1a0ac5fbf77f3232ff7924e110c1030d475c28d125d0a77e",
      "uri": "prepared-dataset.synthetic-artifacts/08d84e2d98b8f2ec1a0ac5fbf77f3232ff7924e110c1030d475c28d125d0a77e.json"
    },
    "fold_assignments": {
      "artifact_id": "f2171988000b4192149865ef1bdaf30dc4e62f7d85f6ae1c372c6fb270a83031",
      "manifest": {
        "kind": "fold_assignments"
      },
      "media_type": "application/json",
      "schema_version": 1,
      "sha256": "f2171988000b4192149865ef1bdaf30dc4e62f7d85f6ae1c372c6fb270a83031",
      "uri": "prepared-dataset.synthetic-artifacts/f2171988000b4192149865ef1bdaf30dc4e62f7d85f6ae1c372c6fb270a83031.json"
    },
    "fold_plan": {
      "artifact_id": "f7c24e1f0c1e523a005f8ad9afdbba566b4f2afb23862802ff86d0dc49135a75",
      "manifest": {
        "kind": "fold_plan"
      },
      "media_type": "application/json",
      "schema_version": 1,
      "sha256": "f7c24e1f0c1e523a005f8ad9afdbba566b4f2afb23862802ff86d0dc49135a75",
      "uri": "prepared-dataset.synthetic-artifacts/f7c24e1f0c1e523a005f8ad9afdbba566b4f2afb23862802ff86d0dc49135a75.json"
    },
    "labels": {
      "artifact_id": "cb664cdba21b342144a9e45dac7288640c97aacdbb25ae070e39cdb20afd912f",
      "manifest": {
        "kind": "labels"
      },
      "media_type": "application/json",
      "schema_version": 1,
      "sha256": "cb664cdba21b342144a9e45dac7288640c97aacdbb25ae070e39cdb20afd912f",
      "uri": "prepared-dataset.synthetic-artifacts/cb664cdba21b342144a9e45dac7288640c97aacdbb25ae070e39cdb20afd912f.json"
    },
    "leakage_report": {
      "artifact_id": "b4fb243665f4a86dd42d410e6be0de50c467b627134755f69c0a742d14bd441c",
      "manifest": {
        "kind": "leakage_report"
      },
      "media_type": "application/json",
      "schema_version": 1,
      "sha256": "b4fb243665f4a86dd42d410e6be0de50c467b627134755f69c0a742d14bd441c",
      "uri": "prepared-dataset.synthetic-artifacts/b4fb243665f4a86dd42d410e6be0de50c467b627134755f69c0a742d14bd441c.json"
    },
    "orientation_provenance": {
      "artifact_id": "3d35d16f1df7603d83c9dc9a06a4161f74e561a1ded462d1685cfc44698239a7",
      "manifest": {
        "kind": "orientation_provenance"
      },
      "media_type": "application/json",
      "schema_version": 1,
      "sha256": "3d35d16f1df7603d83c9dc9a06a4161f74e561a1ded462d1685cfc44698239a7",
      "uri": "prepared-dataset.synthetic-artifacts/3d35d16f1df7603d83c9dc9a06a4161f74e561a1ded462d1685cfc44698239a7.json"
    },
    "selected_slices": {
      "artifact_id": "bb3561cf035c850a64ad0ad8fd361b3f17a79116fddd3310f1369425e33239be",
      "manifest": {
        "kind": "selected_slices"
      },
      "media_type": "application/json",
      "schema_version": 1,
      "sha256": "bb3561cf035c850a64ad0ad8fd361b3f17a79116fddd3310f1369425e33239be",
      "uri": "prepared-dataset.synthetic-artifacts/bb3561cf035c850a64ad0ad8fd361b3f17a79116fddd3310f1369425e33239be.json"
    },
    "source_content": {
      "artifact_id": "faaf7a36e449ac338578375b50bda5ecab714396a0e57dda5e89e81816065250",
      "manifest": {
        "kind": "source_content"
      },
      "media_type": "application/json",
      "schema_version": 1,
      "sha256": "faaf7a36e449ac338578375b50bda5ecab714396a0e57dda5e89e81816065250",
      "uri": "prepared-dataset.synthetic-artifacts/faaf7a36e449ac338578375b50bda5ecab714396a0e57dda5e89e81816065250.json"
    },
    "target_registry": {
      "artifact_id": "0fcdf19b0e2bdfb935426e5ecfee076c6f87eb81ebe775ae71b297f60c2c9b53",
      "manifest": {
        "kind": "target_registry"
      },
      "media_type": "application/json",
      "schema_version": 1,
      "sha256": "0fcdf19b0e2bdfb935426e5ecfee076c6f87eb81ebe775ae71b297f60c2c9b53",
      "uri": "prepared-dataset.synthetic-artifacts/0fcdf19b0e2bdfb935426e5ecfee076c6f87eb81ebe775ae71b297f60c2c9b53.json"
    }
  },
  "dataset_index": {
    "discovery_version": "1",
    "index_id": "a9bfaab9bb43901cc3d9d9c73b5003c54f727c445bb5b5e613b750d290143441",
    "manifest_schema_version": 1,
    "metadata_files": [],
    "root_identity": "7484b90b13650e3df7c25948658b4fd5b2b0f6393c1e66ba379a8c5b29c6b5d2",
    "statistics": {
      "duplicate_sop_uid_count": 0,
      "invalid_files": 0,
      "metadata_files": 0,
      "missing_uid_count": 0,
      "n_series": 2,
      "n_slices": 4,
      "n_studies": 2
    },
    "studies": [
      {
        "metadata": {
          "n_series": 1,
          "patient_id": "synthetic_patient_01",
          "study_instance_uid": "synthetic_study_01"
        },
        "patient_id": "synthetic_patient_01",
        "relative_paths": [
          "synthetic_study_01/synthetic_series_01/01.dcm",
          "synthetic_study_01/synthetic_series_01/02.dcm"
        ],
        "series": [
          {
            "metadata": {
              "ImageOrientationPatient": [
                1,
                0,
                0,
                0,
                1,
                0
              ],
              "ImagePositionPatient": null,
              "InstanceNumber": null,
              "Laterality": "L",
              "PatientID": "synthetic_patient_01",
              "SOPInstanceUID": null,
              "SeriesInstanceUID": "synthetic_series_01",
              "StudyInstanceUID": "synthetic_study_01",
              "metadata_warnings": []
            },
            "n_slices": 2,
            "relative_paths": [
              "synthetic_study_01/synthetic_series_01/01.dcm",
              "synthetic_study_01/synthetic_series_01/02.dcm"
            ],
            "series_id": "ccb0100ab4ee44b21b0a41a8b13fe5fd5d58ba292c40859ede2613796db1abc5",
            "series_instance_uid": "synthetic_series_01",
            "slices": [
              {
                "file_size": 0,
                "metadata": {
                  "ImageOrientationPatient": [
                    1,
                    0,
                    0,
                    0,
                    1,
                    0
                  ],
                  "ImagePositionPatient": [
                    0,
                    0,
                    0.0
                  ],
                  "InstanceNumber": 1,
                  "Laterality": "L",
                  "PatientID": "synthetic_patient_01",
                  "SOPInstanceUID": "synthetic_slice_01_01",
                  "SeriesInstanceUID": "synthetic_series_01",
                  "StudyInstanceUID": "synthetic_study_01",
                  "metadata_warnings": []
                },
                "relative_path": "synthetic_study_01/synthetic_series_01/01.dcm",
                "slice_id": "d9a42a2aaf6fdae5f0c8a058bb7ba6256d590b187822128ef4582b43e2674f39",
                "warnings": []
              },
              {
                "file_size": 0,
                "metadata": {
                  "ImageOrientationPatient": [
                    1,
                    0,
                    0,
                    0,
                    1,
                    0
                  ],
                  "ImagePositionPatient": [
                    0,
                    0,
                    2.5
                  ],
                  "InstanceNumber": 2,
                  "Laterality": "L",
                  "PatientID": "synthetic_patient_01",
                  "SOPInstanceUID": "synthetic_slice_01_02",
                  "SeriesInstanceUID": "synthetic_series_01",
                  "StudyInstanceUID": "synthetic_study_01",
                  "metadata_warnings": []
                },
                "relative_path": "synthetic_study_01/synthetic_series_01/02.dcm",
                "slice_id": "65edfb3d537a31f08397cd0370535fee328d9fc0d612313f16af198bf6e252c1",
                "warnings": []
              }
            ],
            "study_instance_uid": "synthetic_study_01",
            "warnings": []
          }
        ],
        "study_id": "2a14f309f294f16e3e09ce4673237e769b711061bd292fb2fe3bcc2eed58c23c",
        "study_instance_uid": "synthetic_study_01",
        "warnings": []
      },
      {
        "metadata": {
          "n_series": 1,
          "patient_id": "synthetic_patient_02",
          "study_instance_uid": "synthetic_study_02"
        },
        "patient_id": "synthetic_patient_02",
        "relative_paths": [
          "synthetic_study_02/synthetic_series_02/01.dcm",
          "synthetic_study_02/synthetic_series_02/02.dcm"
        ],
        "series": [
          {
            "metadata": {
              "InstanceNumber": null,
              "PatientID": "synthetic_patient_02",
              "SOPInstanceUID": null,
              "SeriesInstanceUID": "synthetic_series_02",
              "StudyInstanceUID": "synthetic_study_02",
              "metadata_warnings": []
            },
            "n_slices": 2,
            "relative_paths": [
              "synthetic_study_02/synthetic_series_02/01.dcm",
              "synthetic_study_02/synthetic_series_02/02.dcm"
            ],
            "series_id": "66c7f593a87199920683dadc72bc637ae8998562025efbbf6bc87259bb1daeda",
            "series_instance_uid": "synthetic_series_02",
            "slices": [
              {
                "file_size": 0,
                "metadata": {
                  "InstanceNumber": 1,
                  "PatientID": "synthetic_patient_02",
                  "SOPInstanceUID": "synthetic_slice_02_01",
                  "SeriesInstanceUID": "synthetic_series_02",
                  "StudyInstanceUID": "synthetic_study_02",
                  "metadata_warnings": []
                },
                "relative_path": "synthetic_study_02/synthetic_series_02/01.dcm",